X,Y,REVISION,NOME,PROVINCIA,CONCELLO,PARROQUIA,LUGAR,X,Y,DATUM,FUSO,INTERESE,DOCUMENTO,APROBADO,PUBLICACIO,FICHA,SIOTUGA,CLASIFICAC,ID_BIC,Nivel_1,CONTORNO,POL,PBA_2018,ID_PBA_201,DUPLICADO_,XENERICO,ID_IPAGA,ID_COPRA,OBSERVACIO,TIPOLOXIA,Buffer,CodImpresi,cod_PBM,_nome,_parroquia,_concello,_coord_x,_coord_y,_lugar,_afec,_tipo_prot,_num_PINF,_num_PORD,_categoria,_tipo,_descricio,_descricic,_uso_actua,_estado_co,_clas_solo,_ord_pba,_act_aut,_act_adic,_clase,_nivel_pro,_cod_snr,_FOTO,_FOTO_2,_ID_IPAGA,icon_url
-8.00998806725191,42.3904467886291,2019/11/11,Xacemento medieval da Castronela de Vilamoure,Ourense,Punxín,Vilamoure (Santo Estevo),Lamas,581487.68240000028,4693603.21939999983,ETRS,29.00000000000,ARQ,PBA,,https://www.xunta.gal/dog/Publicados/2018/20180827/AnuncioG0422-090818-0001_gl.pdf,0.00000000000,"-",CAT,"-","-",SUB,NON,SI,37626.00000000000,"-","-",GA32065006,0.00000000000,"-",,"200",Punxín_67068,1-006,Castronela de Vilamoure,Vilamoure (Santo Estevo),Punxín,"581488","4693603",Lamas,Perímetro,Arqueolóxico,32065_PBM_202204_B_PINF_03ECN_02,32065_PBM_202204_B_PORD_01CL_02,Xacemento ou zona arqueolóxica,1.ARQUEOLÓXICO,"Asentamento de difícil caracterización, de planta semielíptica de 160 m por 50 m. Non se observan estruturas artificiais agás uns terrapléns de 3 m de altura que defenderían un posible recinto","-",,,SRPP,,"Investigación, Valorización, Mantemento, Conservación, Consolidación e Restauración.","-",Ben catalogado,Integral,"-",C:\PBM_PUNXIN\32065_PBM_202307_AI_02EDIT\02.FONTE_DATOS\Arquivos_imaxe\2_Fotografias_Catalogo\1-006.JPG,,GA32065006,./0.png
-8.03117902514676,42.3482722142763,2019/11/11,Castro de San Trocado,Ourense,Punxín,Ourantes (San Xoán),Ourantes,579796.81159999967,4688900.15609999932,ETRS,29.00000000000,ARQ,DSNR Barxelas,,https://www.xunta.gal/dog/Publicados/2013/20130116/AnuncioCA02-080113-0001_gl.html,0.00000000000,http://www.planeamentourbanistico.xunta.es/siotuga/documentos/urbanismo/PUNXIN/documents/27740me001.PDF,CAT,"-","-",SUB,NON,SI,37496.00000000000,"-","-",GA32074005,0.00000000000,Este elemento está bastante desprazado respecto do núcleo de Barxelas. Malia iso semella que se na documentación se refiren a este elemento,,"200",Punxín_67090,1-026,Coto de San Trocado,Ourantes (San Xoán),Punxín,"579797","4688900",Ourantes,Perímetro,Arqueolóxico,32065_PBM_202204_B_PINF_03ECN_03,32065_PBM_202204_B_PORD_01CL_06,Xacemento ou zona arqueolóxica,1.ARQUEOLÓXICO,"Castro de 250 m no cumio dun monte. Alterado por pistas e traballos de explanación. Recinto superior oval defendido por muralla pétrea apoiada en afloramentos graníticos; 2º recinto ao N delimitado por terraplén sobre o que se asenta unha muralla","-",,,"-",,"Investigación, Valorización, Mantemento, Conservación, Consolidación e Restauración.","-",Ben catalogado,Integral,"-",C:\PBM_PUNXIN\32065_PBM_202307_AI_02EDIT\02.FONTE_DATOS\Arquivos_imaxe\2_Fotografias_Catalogo\1-026.JPG,,GA32074005,./0.png
-8.02990840369368,42.3600931538663,2019/11/11,A Cidade de San Cibrán de Lás,Ourense,Punxín,Ourantes (San Xoán),"Torre, A",579886.49349999987,4690213.91349999979,ETRS,29.00000000000,ARQ,DSNR Barxelas,,https://www.xunta.gal/dog/Publicados/2013/20130116/AnuncioCA02-080113-0001_gl.html,0.00000000000,http://www.planeamentourbanistico.xunta.es/siotuga/documentos/urbanismo/PUNXIN/documents/27740me001.PDF,CAT,"-","-",SUB,NON,SI,37495.00000000000,"-","-",GA32074001,0.00000000000,"-",,"200",Punxín_67092,1-023,Zona arqueolóxica de San Cibrao de Las,Ourantes (San Xoán),Punxín,"579886","4690214",A Torre,Perímetro,Arqueolóxico,32065_PBM_202204_B_PINF_03ECN_03,32065_PBM_202204_B_PORD_01CL_04,Xacemento ou zona arqueolóxica,1. ARQUEOLÓXICO,"Castro nun amplo outeiro, de 412 m por 301m ocupado entre os s. II a.C e o IV d.C. Formado por 2 recintos: o superior de 111 m por 80 e un 2º de maior tamaño arredor do 1º. Cada un está defendido por un complexo sistema de murallas, foxos e parapeto","-",,,SRPP/SRPPX/SRPF,,"Investigación, Valorización, Mantemento, Conservación, Consolidación e Restauración.Investigación, Valorización, Mantemento, Conservación, Consolidación e Restauración.","-",Ben catalogado,Integral,"-",C:\PBM_PUNXIN\32065_PBM_202307_AI_02EDIT\02.FONTE_DATOS\Arquivos_imaxe\2_Fotografias_Catalogo\1-023.JPG,,GA32074001,./0.png
-8.00087381491451,42.3689045787419,2019/11/11,Igrexa de Punxín (Parroquial de Santa María),Ourense,Punxín,Punxín (Santa María),"Forxa, A",582266.00000000000,4691220.00000000000,ETRS,29.00000000000,ART,PBA,,https://www.xunta.gal/dog/Publicados/2018/20180827/AnuncioG0422-090818-0001_gl.pdf,0.00000000000,"-",CAT,"-","-",SUB,NON,SI,37538.00000000000,"-","-","-",0.00000000000,SI.2020.069.CON: Sartego de San Wintila na cabeceira da Igrexa AC32065001,Igrexa,"100",Punxín_37594,2.1-006,Igrexa de Punxín (Parroquial de Santa María),Punxín (Santa María),Punxín,"582266","4691220",A Forxa,Perímetro,Arquitectónico e Etnográfico,32065_PBM_202204_B_PINF_03ECN_04,32065_PBM_202204_B_PORD_01CL_05,Monumento,2. ARQUITECTÓNICO,"Igrexa singular por estar orientada cara o leste. As fachadas laterais presentan contrafortes románicos, con dúas portas de arco apuntado cego na súa cara norte. A fachada principal dispón de porta con arco apuntado con arquivoltas, frontón e espada","estilo barroco, existinto ademáis evidencias do gótico. Alberga no seu interior a sepultura de San Wintila, prerrománico do s.IX segundo a inscrición da cuberta. A custodia é do s.XVIII e hai unha cruz do s.XVII obra de Pescouber.",Relixioso,bo,SNRT,,"Investigación, Valorización, Mantemento, Conservación, Consolidación e Restauración.","Adecuarase o entorno inmediato onde se sitúa o ben (pavimento, recollida de augas...), coa previsión da intervención global do espazo exterior de acceso asfaltado, incluída a escaleira, o cruceiro e a zona axardinada que a separa da estrada nacional.",Ben catalogado,Integral,0401-1-T,C:\PBM_PUNXIN\32065_PBM_202307_AI_02EDIT\02.FONTE_DATOS\Arquivos_imaxe\2_Fotografias_Catalogo\2.1-006.JPG,C:\PBM_PUNXIN\32065_PBM_202307_AI_02EDIT\02.FONTE_DATOS\Arquivos_imaxe\2_Fotografias_Catalogo\2.1-006_2.JPG,,
-7.9971545899574,42.3744287780466,2019/11/11,Hórreo en Fontedouro 2,Ourense,Punxín,Punxín (Santa María),"Val, O",582565.00000000000,4691837.00000000000,ETRS,29.00000000000,ETN,PBA,,https://www.xunta.gal/dog/Publicados/2018/20180827/AnuncioG0422-090818-0001_gl.pdf,0.00000000000,"-",CAT,"-","-",SUB,NON,SI,37547.00000000000,"-",HOR,"-",0.00000000000,"-",Hórreo,"50",Punxín_37618,3.1-057,Hórreo en Fontedouro 2,Punxín (Santa María),Punxín,"582565","4691837",Fontedouro,Perímetro,Arquitectónico e Etnográfico,32065_PBM_202204_B_PINF_03ECN_04,32065_PBM_202204_B_PORD_01CL_05,Monumento,3. ETNOGRÁFICO,"Hórreo con estrutura de pedra nos pés e os tornarratos, dispoñendo de dous pares de pés. A cámara é de madeira coas doelas colocadas verticalmente. A cuberta é a dúas augas con estrutura de madeira e cubrición a base de tella cerámica curva.","-",Agrícola,bo,SNRT,,"Investigación, Valorización, Mantemento, Conservación, Consolidación e Restauración.","A limpeza da pedra farase por medios manuais. Recuperaranse as pezas de madeira en bo estado, as novas serán de castaño seleccionado aplicándose imprimación superficial con lasures ou pinturas ao aceite.",Ben catalogado,Integral,0403-1-T,C:\PBM_PUNXIN\32065_PBM_202307_AI_02EDIT\02.FONTE_DATOS\Arquivos_imaxe\2_Fotografias_Catalogo\3.1-057.JPG,C:\PBM_PUNXIN\32065_PBM_202307_AI_02EDIT\02.FONTE_DATOS\Arquivos_imaxe\2_Fotografias_Catalogo\vacio.jpg,,
-7.99687809927852,42.3750117456985,2019/11/11,Hórreo na Castiñeira 1,Ourense,Punxín,Punxín (Santa María),"Val, O",582587.00000000000,4691902.00000000000,ETRS,29.00000000000,ETN,PBA,,https://www.xunta.gal/dog/Publicados/2018/20180827/AnuncioG0422-090818-0001_gl.pdf,0.00000000000,"-",CAT,"-","-",SUB,NON,SI,37545.00000000000,"-",HOR,"-",0.00000000000,"-",Hórreo,"50",Punxín_37663,3.1-058,Hórreo na Castiñeira 1,Punxín (Santa María),Punxín,"582587","4691902",A Castiñeira,Perímetro,Arquitectónico e Etnográfico,32065_PBM_202204_B_PINF_03ECN_02,32065_PBM_202204_B_PORD_01CL_02,Monumento,3. ETNOGRÁFICO,"Hórreo con estrutura de pedra nos pés e os tornarratos, dispoñendo de dous pés. A cámara é de madeira coas doelas colocadas verticalmente. A cuberta é a dúas augas con estrutura de madeira e cubrición a base de tella cerámica curva.","-",Agrícola,bo,SNRT,,"Investigación, Valorización, Mantemento, Conservación, Consolidación e Restauración.","A limpeza da pedra farase por medios manuais. Recuperaranse as pezas de madeira en bo estado, as novas serán de castaño seleccionado aplicándose imprimación superficial con lasures ou pinturas ao aceite.",Ben catalogado,Integral,0403-1-T,C:\PBM_PUNXIN\32065_PBM_202307_AI_02EDIT\02.FONTE_DATOS\Arquivos_imaxe\2_Fotografias_Catalogo\3.1-058.JPG,C:\PBM_PUNXIN\32065_PBM_202307_AI_02EDIT\02.FONTE_DATOS\Arquivos_imaxe\2_Fotografias_Catalogo\3.1-058_2.JPG,,
-8.00020410899482,42.3759053714697,2019/11/11,Hórreo na Moa 2,Ourense,Punxín,Punxín (Santa María),"Rego, O",582312.00000000000,4691998.00000000000,ETRS,29.00000000000,ETN,PBA,,https://www.xunta.gal/dog/Publicados/2018/20180827/AnuncioG0422-090818-0001_gl.pdf,0.00000000000,"-",CAT,"-","-",SUB,NON,SI,37552.00000000000,"-",HOR,"-",0.00000000000,"-",Hórreo,"50",Punxín_37665,3.1-060,Hórreo na Moa 2,Punxín (Santa María),Punxín,"582312","4691998",A Moa,Perímetro,Arquitectónico e Etnográfico,32065_PBM_202204_B_PINF_03ECN_02,32065_PBM_202204_B_PORD_01CL_02,Monumento,3. ETNOGRÁFICO,"Hórreo con estrutura de pedra nos pés e os tornarratos, dispoñendo de dous pares de pés. A cámara é de madeira coas doelas colocadas verticalmente. A cuberta é a dúas augas con estrutura de madeira e cubrición a base de tella cerámica plana.","-",Agrícola,bo,SNRT,,"Investigación, Valorización, Mantemento, Conservación, Consolidación e Restauración.","A limpeza da pedra farase por medios manuais. Recuperaranse as pezas de madeira en bo estado, as novas serán de castaño seleccionado aplicándose imprimación superficial con lasures ou pinturas ao aceite.",Ben catalogado,Integral,0406-1-T,C:\PBM_PUNXIN\32065_PBM_202307_AI_02EDIT\02.FONTE_DATOS\Arquivos_imaxe\2_Fotografias_Catalogo\3.1-060.JPG,C:\PBM_PUNXIN\32065_PBM_202307_AI_02EDIT\02.FONTE_DATOS\Arquivos_imaxe\2_Fotografias_Catalogo\vacio.jpg,,
-7.99986763198172,42.3756772878273,2019/11/11,Hórreo na Moa 3,Ourense,Punxín,Punxín (Santa María),"Rego, O",582340.00000000000,4691973.00000000000,ETRS,29.00000000000,ETN,PBA,,https://www.xunta.gal/dog/Publicados/2018/20180827/AnuncioG0422-090818-0001_gl.pdf,0.00000000000,"-",CAT,"-","-",SUB,NON,SI,37553.00000000000,"-",HOR,"-",0.00000000000,"-",Hórreo,"50",Punxín_37666,3.1-061,Hórreo na Moa 3,Punxín (Santa María),Punxín,"582340","4691973",A Moa,Perímetro,Arquitectónico e Etnográfico,32065_PBM_202204_B_PINF_03ECN_02,32065_PBM_202204_B_PORD_01CL_02,Monumento,3. ETNOGRÁFICO,"Hórreo con estrutura de pedra nos pés e os tornarratos, dispoñendo de dous pares de pés. A cámara é de madeira coas doelas colocadas verticalmente. A cuberta é a dúas augas con estrutura de madeira e cubrición a base de tella cerámica plana.","-",Agrícola,bo,SNRT,,"Investigación, Valorización, Mantemento, Conservación, Consolidación e Restauración.","A limpeza da pedra farase por medios manuais. Recuperaranse as pezas de madeira en bo estado, as novas serán de castaño seleccionado aplicándose imprimación superficial con lasures ou pinturas ao aceite.",Ben catalogado,Integral,0406-1-T,C:\PBM_PUNXIN\32065_PBM_202307_AI_02EDIT\02.FONTE_DATOS\Arquivos_imaxe\2_Fotografias_Catalogo\3.1-061.JPG,C:\PBM_PUNXIN\32065_PBM_202307_AI_02EDIT\02.FONTE_DATOS\Arquivos_imaxe\2_Fotografias_Catalogo\vacio.jpg,,
-8.00023310892355,42.3748429224889,2019/11/11,Hórreo na Moa 4,Ourense,Punxín,Punxín (Santa María),"Moa, A",582311.00000000000,4691880.00000000000,ETRS,29.00000000000,ETN,PBA,,https://www.xunta.gal/dog/Publicados/2018/20180827/AnuncioG0422-090818-0001_gl.pdf,0.00000000000,"-",CAT,"-","-",SUB,NON,SI,37554.00000000000,"-",HOR,"-",0.00000000000,"-",Hórreo,"50",Punxín_37667,3.1-062,Hórreo na Moa 4,Punxín (Santa María),Punxín,"582311","4691880",A Moa,Perímetro,Arquitectónico e Etnográfico,32065_PBM_202204_B_PINF_03ECN_04,32065_PBM_202204_B_PORD_01CL_05,Monumento,3. ETNOGRÁFICO,"Hórreo con estrutura de pedra nos pés e os tornarratos, dispoñendo de dous pares de pés. A cámara é de pedra e madeira coas doelas colocadas verticalmente. A cuberta é a dúas augas.","-",Agrícola,bo,SRPP,,"Investigación, Valorización, Mantemento, Conservación, Consolidación e Restauración.","A limpeza da pedra farase por medios manuais. Recuperaranse as pezas de madeira en bo estado, as novas serán de castaño seleccionado aplicándose imprimación superficial con lasures ou pinturas ao aceite.",Ben catalogado,Integral,"-",C:\PBM_PUNXIN\32065_PBM_202307_AI_02EDIT\02.FONTE_DATOS\Arquivos_imaxe\2_Fotografias_Catalogo\3.1-062.JPG,C:\PBM_PUNXIN\32065_PBM_202307_AI_02EDIT\02.FONTE_DATOS\Arquivos_imaxe\2_Fotografias_Catalogo\vacio.jpg,,
-7.99742288014223,42.3751245826822,2019/11/11,Hórreos (3) na Castiñeira,Ourense,Punxín,Punxín (Santa María),Fontedouro,582542.00000000000,4691914.00000000000,ETRS,29.00000000000,ETN,PBA,,https://www.xunta.gal/dog/Publicados/2018/20180827/AnuncioG0422-090818-0001_gl.pdf,0.00000000000,"-",CAT,"-","-",SUB,NON,SI,37544.00000000000,"-",HOR,"-",0.00000000000,"-",Hórreo,"50",Punxín_37696,3.1-067,Hórreos (3) na Castiñeira,Punxín (Santa María),Punxín,"582542","4691914",A Castiñeira,Perímetro,Arquitectónico e Etnográfico,32065_PBM_202204_B_PINF_03ECN_02,32065_PBM_202204_B_PORD_01CL_02,Monumento,3. ETNOGRÁFICO,"Hórreos con estrutura de pedra nos pés e os tornarratos, dispoñendo de dous pares de pés cada un deles. As cámaras son de madeira coas doelas colocadas verticalmente. As cubertas dos tres son a dúas augas con estrutura de madeira e cubrición a",base de tella cerámica plana.,Agrícola,bo,SNRT/SRPP,,"Investigación, Valorización, Mantemento, Conservación, Consolidación e Restauración.","A limpeza da pedra farase por medios manuais. Recuperaranse as pezas de madeira en bo estado, as novas serán de castaño seleccionado aplicándose imprimación superficial con lasures ou pinturas ao aceite.",Ben catalogado,Integral,0403-1-T,C:\PBM_PUNXIN\32065_PBM_202307_AI_02EDIT\02.FONTE_DATOS\Arquivos_imaxe\2_Fotografias_Catalogo\3.1-067.JPG,C:\PBM_PUNXIN\32065_PBM_202307_AI_02EDIT\02.FONTE_DATOS\Arquivos_imaxe\2_Fotografias_Catalogo\vacio.jpg,,
-8.00047849835218,42.3688433806801,,Cruceiro na Igrexa de Santa María,Ourense,Punxín,Punxín (Santa María),"Forxa, A",582298.62975837686,4691213.58733916562,ETRS,29.00000000000,ETN,"DSNR A Forxa, San Roque, As Quintás e O Bacelo",,,,,CAT,,,,NON,,,,,,,,Cruceiro,,,3.6-004,Cruceiro na Igrexa de Santa María,Punxín (Santa María),Punxín,"582299","4691214",A Forxa,Perímetro,Arquitectónico e Etnográfico,32065_PBM_202204_B_PINF_03ECN_04,32065_PBM_202204_B_PORD_01CL_05,Monumento,3. ETNOGRÁFICO,Situado en plataforma intermedia de escaleiras de acceso á igrexa parroquial nunha mezcla de muros de pedra e de formigón. O cruceiro presenta un pedestal rectangular de cemento sobre do que parte o fuste cilíndrico rematado por un capitel de figuraci,"relixiosa con cruz latina, onde na cara frontal represéntase o Cristo crucificado e na cara posterior á Virxe.",Relixioso,bo,SNRT,,"Investigación, Valorización, Mantemento, Conservación, Consolidación e Restauración.",Adecuarase de modo conveniente no entorno inmediato onde se sitúa o ben.,Ben catalogado,Integral,0401-1-T,C:\PBM_PUNXIN\32065_PBM_202307_AI_02EDIT\02.FONTE_DATOS\Arquivos_imaxe\2_Fotografias_Catalogo\3.6-004.JPG,C:\PBM_PUNXIN\32065_PBM_202307_AI_02EDIT\02.FONTE_DATOS\Arquivos_imaxe\2_Fotografias_Catalogo\vacio.jpg,,
-8.00054036695732,42.3688487559873,,Fonte na Igrexa de Santa María,Ourense,Punxín,Punxín (Santa María),"Forxa, A",582293.52855395107,4691214.12430805247,ETRS,29.00000000000,ETN,"DSNR A Forxa, San Roque, As Quintás e O Bacelo",,,,,CAT,,,,NON,,,,,,,,Fonte,,,3.4-001,Fonte na Igrexa de Santa María,Punxín (Santa María),Punxín,"582293","4691214",A Forxa,Perímetro,Arquitectónico e Etnográfico,32065_PBM_202204_B_PINF_03ECN_04,32065_PBM_202204_B_PORD_01CL_05,Monumento,3. ETNOGRÁFICO,Situado en plataforma intermedia de escaleiras de acceso á igrexa parroquial nunha mezcla de muros de pedra e de formigón. Está encastrada no cerramento de pedra con jamba de sillares con columna rematada con capitel floral no seu lado dereito e dinte,con inscrición.,Público,bo,SNRT,,"Investigación, Valorización, Mantemento, Conservación, Consolidación e Restauración.",Adecuarase de modo conveniente no entorno inmediato onde se sitúa o ben.,Ben catalogado,Integral,0401-1-T,C:\PBM_PUNXIN\32065_PBM_202307_AI_02EDIT\02.FONTE_DATOS\Arquivos_imaxe\2_Fotografias_Catalogo\3.4-001.JPG,C:\PBM_PUNXIN\32065_PBM_202307_AI_02EDIT\02.FONTE_DATOS\Arquivos_imaxe\2_Fotografias_Catalogo\vacio.jpg,,
-8.00168017595328,42.3694033325998,,Pombal,Ourense,Punxín,Punxín (Santa María),"Forxa, A",582198.95490874199,4691274.60042894538,ETRS,29.00000000000,ETN,"DSNR A Forxa, San Roque, As Quintás e O Bacelo",,,,,CAT,,,,NON,,,,,,,,Pombal,,,3.2-001,Pombal,Punxín (Santa María),Punxín,"582199","4691274",A Forxa,Perímetro,Arquitectónico e Etnográfico,32065_PBM_202204_B_PINF_03ECN_04,32065_PBM_202204_B_PORD_01CL_05,Monumento,3. ETNOGRÁFICO,Pombal de planta circular duns 5 metros de diámetro que recolle no seu interior celdas ou nichos para palomas. O cerramento está revestido. A cuberta de tella cerámica remátase cunha linterna central a modo de pináculo. O pombal localízase na parte,da finca singular pertencente á casa reitoral.,Pombal,bo,SR,,"Investigación, Valorización, Mantemento, Conservación, Consolidación e Restauración.",Adecuarase de maneira conveniente o entorno inmediato onde se sitúa o ben.,Ben catalogado,Estrutural,"-",C:\PBM_PUNXIN\32065_PBM_202307_AI_02EDIT\02.FONTE_DATOS\Arquivos_imaxe\2_Fotografias_Catalogo\3.2-001.JPG,C:\PBM_PUNXIN\32065_PBM_202307_AI_02EDIT\02.FONTE_DATOS\Arquivos_imaxe\2_Fotografias_Catalogo\3.2-001_2.jpg,,
-7.99959772081112,42.3718980432736,,Hórreo,Ourense,Punxín,Punxín (Santa María),"Bacelo, O",582367.16041257035,4691553.62288681418,ETRS,29.00000000000,ETN,"DSNR A Forxa, San Roque, As Quintás e O Bacelo",,,,,CAT,,,,NON,,,,,,,,Hórreo,,,3.1-055,Hórreo,Punxín (Santa María),Punxín,"582367","4691554",O Bacelo,Perímetro,Arquitectónico e Etnográfico,32065_PBM_202204_B_PINF_03ECN_04,32065_PBM_202204_B_PORD_01CL_05,Monumento,3. ETNOGRÁFICO,"Hórreo con estrutura de pedra nos pés e os tornarratos, dispoñendo de dous pares de pés. A cámara é de madeira coas doelas colocadas verticalmente. A cuberta é a dúas augas con estrutura de madeira e cubrición a base de tella cerámica curva.","-",Agrícola,bo,SNRC,,"Investigación, Valorización, Mantemento, Conservación, Consolidación e Restauración.","A limpeza da pedra farase por medios manuais. Recuperaranse as pezas de madeira en bo estado, as novas serán de castaño seleccionado aplicándose imprimación superficial con lasures ou pinturas ao aceite.",Ben catalogado,Integral,0401-2-C,C:\PBM_PUNXIN\32065_PBM_202307_AI_02EDIT\02.FONTE_DATOS\Arquivos_imaxe\2_Fotografias_Catalogo\3.1-055.JPG,C:\PBM_PUNXIN\32065_PBM_202307_AI_02EDIT\02.FONTE_DATOS\Arquivos_imaxe\2_Fotografias_Catalogo\3.1-055_2.jpg,,
-7.99992976824893,42.3712655461792,,Hórreo,Ourense,Punxín,Punxín (Santa María),San Roque,582340.64757377969,4691483.07020916138,ETRS,29.00000000000,ETN,"DSNR A Forxa, San Roque, As Quintás e O Bacelo",,,,,CAT,,,,NON,,,,,,,,Hórreo,,,3.1-054,Hórreo,Punxín (Santa María),Punxín,"582341","4691483",San Roque,Perímetro,Arquitectónico e Etnográfico,32065_PBM_202204_B_PINF_03ECN_04,32065_PBM_202204_B_PORD_01CL_05,Monumento,3. ETNOGRÁFICO,"Hórreo con estrutura de pedra nos pés e os tornarratos, dispoñendo de dous pares de pés. A cámara é de madeira coas doelas colocadas verticalmente. A cuberta é a dúas augas con estrutura de madeira e cubrición a base de tella cerámica curva.","-",Agrícola,bo,SNRT,,"Investigación, Valorización, Mantemento, Conservación, Consolidación e Restauración.","A limpeza da pedra farase por medios manuais. Recuperaranse as pezas de madeira en bo estado, as novas serán de castaño seleccionado aplicándose imprimación superficial con lasures ou pinturas ao aceite.",Ben catalogado,Integral,0401-1-T,C:\PBM_PUNXIN\32065_PBM_202307_AI_02EDIT\02.FONTE_DATOS\Arquivos_imaxe\2_Fotografias_Catalogo\3.1-054.JPG,C:\PBM_PUNXIN\32065_PBM_202307_AI_02EDIT\02.FONTE_DATOS\Arquivos_imaxe\2_Fotografias_Catalogo\3.1-054_2.jpg,,
-7.99892594810457,42.37048832754,,Hórreo,Ourense,Punxín,Punxín (Santa María),"Quintás, As",582424.31403847318,4691397.74249697383,ETRS,29.00000000000,ETN,"DSNR A Forxa, San Roque, As Quintás e O Bacelo",,,,,CAT,,,,NON,,,,,,,,Hórreo,,,3.1-053,Hórreo,Punxín (Santa María),Punxín,"582424","4691398",As Quintás,Perímetro,Arquitectónico e Etnográfico,32065_PBM_202204_B_PINF_03ECN_04,32065_PBM_202204_B_PORD_01CL_05,Monumento,3. ETNOGRÁFICO,"Hórreo con estrutura de pedra nos pés e os tornarratos, dispoñendo de dous pares de pés. A cámara é de madeira coas doelas colocadas verticalmente. A cuberta é a dúas augas con estrutura de madeira e cubrición a base de tella cerámica curva.","-",Agrícola,bo,SNRT,,"Investigación, Valorización, Mantemento, Conservación, Consolidación e Restauración.","A limpeza da pedra farase por medios manuais. Recuperaranse as pezas de madeira en bo estado, as novas serán de castaño seleccionado aplicándose imprimación superficial con lasures ou pinturas ao aceite. Eliminaranse os elementos discordantes.",Ben catalogado,Integral,0401-2-T,C:\PBM_PUNXIN\32065_PBM_202307_AI_02EDIT\02.FONTE_DATOS\Arquivos_imaxe\2_Fotografias_Catalogo\3.1-053.JPG,C:\PBM_PUNXIN\32065_PBM_202307_AI_02EDIT\02.FONTE_DATOS\Arquivos_imaxe\2_Fotografias_Catalogo\3.1-053_2.jpg,,
-7.99863740017606,42.3700628158373,,Hórreo,Ourense,Punxín,Punxín (Santa María),"Quintás, As",582448.62866088399,4691350.77449964546,ETRS,29.00000000000,ETN,"DSNR A Forxa, San Roque, As Quintás e O Bacelo",,,,,CAT,,,,NON,,,,,,,,Hórreo,,,3.1-052,Hórreo,Punxín (Santa María),Punxín,"582449","4691351",As Quintás,Perímetro,Arquitectónico e Etnográfico,32065_PBM_202204_B_PINF_03ECN_04,32065_PBM_202204_B_PORD_01CL_05,Monumento,3. ETNOGRÁFICO,"Hórreo con estrutura de pedra nos pés e os tornarratos, dispoñendo de dous pares de pés. A cámara é de madeira coas doelas colocadas verticalmente. A cuberta é a dúas augas con estrutura de madeira e cubrición a base de tella cerámica curva.","-",Agrícola,regular,SNRT,,"Investigación, Valorización, Mantemento, Conservación, Consolidación e Restauración.","A limpeza da pedra farase por medios manuais. Recuperaranse as pezas de madeira en bo estado, as novas serán de castaño seleccionado aplicándose imprimación superficial con lasures ou pinturas ao aceite.",Ben catalogado,Integral,0401-2-T,C:\PBM_PUNXIN\32065_PBM_202307_AI_02EDIT\02.FONTE_DATOS\Arquivos_imaxe\2_Fotografias_Catalogo\3.1-052.JPG,C:\PBM_PUNXIN\32065_PBM_202307_AI_02EDIT\02.FONTE_DATOS\Arquivos_imaxe\2_Fotografias_Catalogo\3.1-052_2.jpg,,
-8.00068785676704,42.3690324087619,,Casa reitoral,Ourense,Punxín,Punxín (Santa María),"Forxa, A",582281.14470899745,4691234.37390819751,ETRS,29.00000000000,ART,"DSNR A Forxa, San Roque, As Quintás e O Bacelo",,,,,CAT,,,,NON,,,,,,,,Casa reitoral,,,2.2-002,Casa reitoral,Punxín (Santa María),Punxín,"582281","4691234",A Forxa,Perímetro,Arquitectónico e Etnográfico,32065_PBM_202204_B_PINF_03ECN_04,32065_PBM_202204_B_PORD_01CL_05,Monumento,2. ARQUITECTÓNICO,"Casa reitoral de dúas plantas, a inferior destinada a adega, cortes..., a superior de uso residencial, con cerramento a base de sillería de formato regular. A edificación principal e os seus anexos dispóñense entorno a un patio de entrada delimitado",polos altos muros e un portalón de amplas dimensións sobre o que se atopa unha balconada sobre canzorros de pedra. O acceso á planta superior faise a través dunhas escaleiras situadas no patio. A cuberta é a catro augas con cubrición de tella cerá,Residencial,regular,SNRT,,"Investigación, Valorización, Mantemento, Conservación, Consolidación e Restauración.","Manteranse os ocos co formato existente sustituíndo as carpinterías de aluminio. Rexuntarase o cerramento con morteiro de cal refundido, de tonalidade similar á da pedra. Revisión dos elementos acaroados aos paramentos (antenas de TV, farolas...)",Ben catalogado,Estrutural,0401-1-T,C:\PBM_PUNXIN\32065_PBM_202307_AI_02EDIT\02.FONTE_DATOS\Arquivos_imaxe\2_Fotografias_Catalogo\2.2-002.JPG,C:\PBM_PUNXIN\32065_PBM_202307_AI_02EDIT\02.FONTE_DATOS\Arquivos_imaxe\2_Fotografias_Catalogo\2.2-002_2.jpg,,
